<?xml version="1.0" encoding="UTF-8"?>
<?xml-model href="tennis.xsd" type="application/xml"?>
<root>
    <tennis_seasons xmlns:xsi="http://www.w3.org/2001/XMLSchema-instance"
        xsi:noNamespaceSchemaLocation="tennis.xsd">
           <tennis_season year="2015">
            <tournament name="Australian_Open" type="Grand_Slam" surface="Hard">               
                <finals>
                    <match>
                        <players>
                            <player-ref id="Djokovic"/>
                            <player-ref id="Murray"/>
                        </players>
                        <result>
                            <set>7:6</set>
                            <set>6:7</set>
                            <set>6:3</set>
                            <set>6:0</set>
                        </result>
                    </match>
                </finals>               
                <semi-finals>       
                    <match>
                        <players>         
                            <player-ref id="Djokovic"/>
                            <player-ref id="Wawrinka"/>   
                        </players>
                        <result>
                            <set>7:6</set>
                            <set>3:6</set>
                            <set>6:4</set>
                            <set>4:6</set>
                            <set>6:0</set>
                        </result>
                    </match>                   
                    <match>
                        <players>
                            <player-ref id="Murray"/>
                            <player-ref id="Berdych"/>    
                        </players>
                        <result>
                            <set>6:7</set>
                            <set>6:0</set>
                            <set>6:3</set>
                            <set>7:5</set>
                            <set>6:2</set>
                        </result>
                    </match>                  
                </semi-finals>                
                <quarter-finals>                    
                    <match>
                        <players>
                            <player-ref id="Djokovic"/>
                            <player-ref id="Raonic"/>
                        </players>
                        <result>
                            <set>7:6</set>
                            <set>6:4</set>
                            <set>6:2</set>
                        </result>
                    </match>
                    <match>
                        <players>
                            <player-ref id="Berdych"/>
                            <player-ref id="Nadal"/>   
                        </players>
                        <result>
                            <set>6:2</set>
                            <set>6:0</set>
                            <set>7:6</set>
                        </result>
                    </match>
                    <match>
                        <players>
                            <player-ref id="Wawrinka"/>
                            <player-ref id="Nishikori"/>
                        </players>
                        <result>
                            <set>6:3</set>
                            <set>6:4</set>
                            <set>7:6</set>
                        </result>
                    </match>
                    <match>
                        <players>
                            <player-ref id="Murray"/>
                            <player-ref id="Kyrgios"/>   
                        </players>
                        <result>
                            <set>6:3</set>
                            <set>7:6</set>
                            <set>6:3</set>
                        </result>
                    </match>                 
                </quarter-finals>
            </tournament>
            <tournament name="Roland_Garros" type="Grand_Slam" surface="Clay">               
                <finals>
                    <match>
                        <players>
                            <player-ref id="Wawrinka"/>
                            <player-ref id="Djokovic"/>
                        </players>
                        <result>
                            <set>4:6</set>
                            <set>6:4</set>
                            <set>6:3</set>
                            <set>6:4</set>
                        </result>
                    </match>
                </finals>               
                <semi-finals>       
                    <match>
                        <players>         
                            <player-ref id="Djokovic"/>
                            <player-ref id="Murray"/>   
                        </players>
                        <result>
                            <set>6:3</set>
                            <set>6:3</set>
                            <set>5:7</set>
                            <set>5:7</set>
                            <set>6:1</set>
                        </result>
                    </match>                   
                    <match>
                        <players>
                            <player-ref id="Wawrinka"/>
                            <player-ref id="Tsonga"/>    
                        </players>
                        <result>
                            <set>6:3</set>
                            <set>6:7</set>
                            <set>7:6</set>
                            <set>6:4</set>
                        </result>
                    </match>                  
                </semi-finals>                
                <quarter-finals>                    
                    <match>
                        <players>
                            <player-ref id="Djokovic"/>
                            <player-ref id="Nadal"/>
                        </players>
                        <result>
                            <set>7:6</set>
                            <set>6:3</set>
                            <set>6:1</set>
                        </result>
                    </match>
                    <match>
                        <players>
                            <player-ref id="Wawrinka"/>
                            <player-ref id="Federer"/>   
                        </players>
                        <result>
                            <set>6:4</set>
                            <set>6:3</set>
                            <set>7:6</set>
                        </result>
                    </match>
                    <match>
                        <players>
                            <player-ref id="Murray"/>
                            <player-ref id="Ferrer"/>
                        </players>
                        <result>
                            <set>7:6</set>
                            <set>6:2</set>
                            <set>5:7</set>
                            <set>6:1</set>
                        </result>
                    </match>
                    <match>
                        <players>
                            <player-ref id="Tsonga"/>
                            <player-ref id="Nishikori"/>   
                        </players>
                        <result>
                            <set>6:1</set>
                            <set>6:4</set>
                            <set>4:6</set>
                            <set>3:6</set>
                            <set>6:3</set>
                        </result>
                    </match>                 
                </quarter-finals>
            </tournament>
            
            <tournament name="Wimbledon" type="Grand_Slam" surface="Grass">               
                <finals>
                    <match>
                        <players>
                            <player-ref id="Djokovic"/>
                            <player-ref id="Federer"/>
                        </players>
                        <result>
                            <set>7:6</set>
                            <set>6:7</set>
                            <set>6:4</set>
                            <set>6:3</set>
                        </result>
                    </match>
                </finals>               
                <semi-finals>       
                    <match>
                        <players>         
                            <player-ref id="Djokovic"/>
                            <player-ref id="Gasquet"/>   
                        </players>
                        <result>
                            <set>7:6</set>
                            <set>6:4</set>
                            <set>6:4</set>
                        </result>
                    </match>                   
                    <match>
                        <players>
                            <player-ref id="Federer"/>
                            <player-ref id="Murray"/>    
                        </players>
                        <result>
                            <set>7:5</set>
                            <set>7:5</set>
                            <set>6:4</set>
                        </result>
                    </match>                  
                </semi-finals>                
                <quarter-finals>                    
                    <match>
                        <players>
                            <player-ref id="Djokovic"/>
                            <player-ref id="Cilic"/>
                        </players>
                        <result>
                            <set>6:4</set>
                            <set>6:4</set>
                            <set>6:4</set>
                        </result>
                    </match>
                    <match>
                        <players>
                            <player-ref id="Federer"/>